{
  "$schema": "https://json-schema.org/draft/2020-12/schema",
  "type": "object",
  "properties": {
    "id": {
      "type": "string",
      "pattern": "^[A-Z]+_[A-Z]+$"
    },
    "operator": {
      "type": "string",
      "minLength": 1
    },
    "name_th": {
      "type": "string",
      "minLength": 1
    },
    "name_en": {
      "type": "string",
      "minLength": 1
    },
    "color_hex": {
      "type": "string",
      "pattern": "^#[0-9A-Fa-f]{6}$"
    },
    "milestones": {
      "type": "array",
      "items": {
        "type": "object",
        "properties": {
          "date": {
            "type": "string",
            "format": "date",
            "pattern": "^(?:(?:\\d\\d[2468][048]|\\d\\d[13579][26]|\\d\\d0[48]|[02468][048]00|[13579][26]00)-02-29|\\d{4}-(?:(?:0[13578]|1[02])-(?:0[1-9]|[12]\\d|3[01])|(?:0[469]|11)-(?:0[1-9]|[12]\\d|30)|(?:02)-(?:0[1-9]|1\\d|2[0-8])))$"
          },
          "date_precision": {
            "type": "string",
            "enum": ["exact", "month", "year", "disputed"]
          },
          "event": {
            "type": "string",
            "enum": [
              "construction_started",
              "trial_run",
              "opened",
              "extended",
              "renamed",
              "recoded",
              "suspended",
              "closed"
            ]
          },
          "line": {
            "type": "string",
            "minLength": 1
          },
          "source_refs": {
            "minItems": 1,
            "type": "array",
            "items": {
              "type": "object",
              "properties": {
                "url": {
                  "type": "string",
                  "format": "uri"
                },
                "title": {
                  "type": "string",
                  "minLength": 1
                },
                "published_at": {
                  "anyOf": [
                    {
                      "type": "string",
                      "format": "date",
                      "pattern": "^(?:(?:\\d\\d[2468][048]|\\d\\d[13579][26]|\\d\\d0[48]|[02468][048]00|[13579][26]00)-02-29|\\d{4}-(?:(?:0[13578]|1[02])-(?:0[1-9]|[12]\\d|3[01])|(?:0[469]|11)-(?:0[1-9]|[12]\\d|30)|(?:02)-(?:0[1-9]|1\\d|2[0-8])))$"
                    },
                    {
                      "type": "null"
                    }
                  ]
                }
              },
              "required": ["url", "title"],
              "additionalProperties": false
            }
          }
        },
        "required": ["date", "date_precision", "event", "source_refs"],
        "additionalProperties": false
      }
    },
    "confidence": {
      "type": "string",
      "enum": ["high", "medium", "low"]
    },
    "last_verified_at": {
      "type": "string",
      "format": "date",
      "pattern": "^(?:(?:\\d\\d[2468][048]|\\d\\d[13579][26]|\\d\\d0[48]|[02468][048]00|[13579][26]00)-02-29|\\d{4}-(?:(?:0[13578]|1[02])-(?:0[1-9]|[12]\\d|3[01])|(?:0[469]|11)-(?:0[1-9]|[12]\\d|30)|(?:02)-(?:0[1-9]|1\\d|2[0-8])))$"
    }
  },
  "required": [
    "id",
    "operator",
    "name_th",
    "name_en",
    "color_hex",
    "milestones",
    "confidence",
    "last_verified_at"
  ],
  "additionalProperties": false
}
