{
  "id": "MRT_YELLOW",
  "operator": "EBM",
  "name_th": "รถไฟฟ้ามหานคร สายสีเหลือง",
  "name_en": "MRT Yellow Line",
  "color_hex": "#FFD400",
  "milestones": [
    {
      "date": "2018-06-29",
      "date_precision": "exact",
      "event": "construction_started",
      "source_refs": [
        {
          "url": "https://ebm.co.th/en/history/",
          "title": "Eastern Bangkok Monorail - History (contract signed 16 June 2017; notice to proceed for the Yellow Line issued 29 June 2018)",
          "published_at": null
        }
      ]
    },
    {
      "date": "2023-06-03",
      "date_precision": "exact",
      "event": "trial_run",
      "source_refs": [
        {
          "url": "https://www.nationthailand.com/thailand/general/40028424",
          "title": "Fares to be collected on Yellow Line from July 3: MRTA - The Nation (free trial started 3 June 2023)",
          "published_at": "2023-06-11"
        },
        {
          "url": "https://www.thaipbsworld.com/around-thailand/yellow-line-train-free-trial-service-to-be-extended-to-22-stations-from-monday",
          "title": "Yellow Line train free trial service to be extended to 22 stations from Monday - Thai PBS World (13 stations Hua Mak to Samrong, extended to 22 stations on 12 June 2023)",
          "published_at": "2023-06-11"
        },
        {
          "url": "https://en.wikipedia.org/wiki/Yellow_Line_(Bangkok)",
          "title": "Yellow Line (Bangkok) - Wikipedia (trial 3 June 2023 from Hua Mak to Samrong, Phawana-Hua Mak 12 June, Lat Phrao 19 June; opened 3 July 2023)",
          "published_at": null
        }
      ]
    },
    {
      "date": "2023-07-03",
      "date_precision": "exact",
      "event": "opened",
      "source_refs": [
        {
          "url": "https://www.nationthailand.com/thailand/general/40028424",
          "title": "Fares to be collected on Yellow Line from July 3: MRTA - The Nation (free trial started 3 June 2023)",
          "published_at": "2023-06-11"
        },
        {
          "url": "https://en.wikipedia.org/wiki/Yellow_Line_(Bangkok)",
          "title": "Yellow Line (Bangkok) - Wikipedia (trial 3 June 2023 from Hua Mak to Samrong, Phawana-Hua Mak 12 June, Lat Phrao 19 June; opened 3 July 2023)",
          "published_at": null
        }
      ]
    }
  ],
  "confidence": "high",
  "last_verified_at": "2026-10-06"
}
