{
  "id": "BTS_GOLD",
  "operator": "BTS",
  "name_th": "รถไฟฟ้าบีทีเอส สายสีทอง",
  "name_en": "BTS Gold Line",
  "color_hex": "#A58704",
  "milestones": [
    {
      "date": "2018-08-01",
      "date_precision": "disputed",
      "event": "construction_started",
      "source_refs": [
        {
          "url": "https://en.wikipedia.org/wiki/Gold_Line_(Bangkok)",
          "title": "Gold Line (Bangkok) - Wikipedia (preliminary works June 2018, major construction September 2018; test runs from 11 September 2020; opened 16 December 2020)",
          "published_at": null
        },
        {
          "url": "https://www.railway-technology.com/projects/gold-line-automated-mass-transit-system/",
          "title": "Gold Line Automated Mass Transit System, Bangkok - Railway Technology (construction start August 2018)",
          "published_at": null
        }
      ]
    },
    {
      "date": "2020-09-11",
      "date_precision": "exact",
      "event": "trial_run",
      "source_refs": [
        {
          "url": "https://www.nationthailand.com/news/30394429",
          "title": "Gold Line monorail set to roll out in October after successful test run - The Nation (test run on Friday 11 September 2020)",
          "published_at": "2020-09-12"
        },
        {
          "url": "https://en.wikipedia.org/wiki/Gold_Line_(Bangkok)",
          "title": "Gold Line (Bangkok) - Wikipedia (preliminary works June 2018, major construction September 2018; test runs from 11 September 2020; opened 16 December 2020)",
          "published_at": null
        }
      ]
    },
    {
      "date": "2020-12-16",
      "date_precision": "exact",
      "event": "opened",
      "source_refs": [
        {
          "url": "https://www.railwaygazette.com/bangkok-gold-line-peoplemover-opens/58047.article",
          "title": "Bangkok Gold Line peoplemover opens - Railway Gazette International",
          "published_at": "2020-12-16"
        },
        {
          "url": "https://www.nationthailand.com/in-focus/30399052",
          "title": "Gold Line monorail to open Dec 16 at Bt15 per trip - The Nation",
          "published_at": "2020-12-03"
        },
        {
          "url": "https://en.wikipedia.org/wiki/Gold_Line_(Bangkok)",
          "title": "Gold Line (Bangkok) - Wikipedia (preliminary works June 2018, major construction September 2018; test runs from 11 September 2020; opened 16 December 2020)",
          "published_at": null
        }
      ]
    }
  ],
  "confidence": "medium",
  "last_verified_at": "2026-10-06"
}
