{
  "id": "MRT_PURPLE",
  "operator": "MRTA",
  "name_th": "รถไฟฟ้ามหานคร สายฉลองรัชธรรม",
  "name_en": "MRT Purple Line",
  "color_hex": "#7C3AED",
  "milestones": [
    {
      "date": "2016-08-06",
      "date_precision": "exact",
      "event": "opened",
      "source_refs": [
        {
          "url": "https://en.wikipedia.org/wiki/Purple_Line_(Bangkok)",
          "title": "Purple Line (Bangkok) - Wikipedia (Khlong Bang Phai-Tao Poon opened 6 August 2016)",
          "published_at": null
        }
      ]
    }
  ],
  "confidence": "high",
  "last_verified_at": "2026-09-01"
}
